{
  "schema_version": "1.0",
  "enabled": true,
  "actor": "Hengyi Zang",
  "confirmed_at": "2026-09-30T17:24:37+00:00",
  "confirmation_note": "我确认，改成每天24小时不停，直到满足论文要求",
  "system_execution_hours_per_day": 24,
  "resume_interval_minutes": 15,
  "constraints_sha256": "301cd5ee3bf4cc0f693e95e41c9ccf72237b31d9815633a2ed17308f49630f5d",
  "g0_approval_artifact_sha256": "55d9d970de11ace265afff500560af3066b6b2168f16064393aeaf3f6a34bf7a",
  "stop_when": "all_papers_submission_ready"
}
